{
  "$schema": "http://json-schema.org/draft-07/schema#",
  "$id": "https://www.x7finance.org/tokenlist.schema.json",
  "title": "Xchange Token List",
  "description": "Schema for lists of tokens compatible with the Xchange Interface",
  "definitions": {
    "Version": {
      "type": "object",
      "description": "The version of the list, used in change detection",
      "properties": {
        "major": {
          "type": "integer",
          "description": "The major version of the list. Must be incremented when tokens are removed from the list or token addresses are changed.",
          "minimum": 0
        },
        "minor": {
          "type": "integer",
          "description": "The minor version of the list. Must be incremented when tokens are added to the list.",
          "minimum": 0
        },
        "patch": {
          "type": "integer",
          "description": "The patch version of the list. Must be incremented for any changes to the list.",
          "minimum": 0
        }
      },
      "required": ["major", "minor", "patch"]
    },
    "TokenInfo": {
      "type": "object",
      "description": "Metadata for a single token in a token list",
      "properties": {
        "chainId": {
          "type": "integer",
          "description": "The chain ID of the Ethereum network where this token is deployed",
          "minimum": 1
        },
        "address": {
          "type": "string",
          "description": "The checksummed address of the token on the specified chain ID",
          "pattern": "^0x[a-fA-F0-9]{40}$"
        },
        "decimals": {
          "type": "integer",
          "description": "The number of decimals for the token balance",
          "minimum": 0,
          "maximum": 255
        },
        "name": {
          "type": "string",
          "description": "The name of the token",
          "minLength": 1,
          "maxLength": 40
        },
        "symbol": {
          "type": "string",
          "description": "The symbol for the token",
          "minLength": 1,
          "maxLength": 20
        },
        "extensions": {
          "type": "object",
          "description": "Optional metadata for the token",
          "additionalProperties": true
        }
      },
      "required": ["chainId", "address", "decimals", "name", "symbol"]
    }
  },
  "type": "object",
  "properties": {
    "name": {
      "type": "string",
      "description": "The name of the token list",
      "minLength": 1,
      "maxLength": 50
    },
    "timestamp": {
      "type": "string",
      "format": "date-time",
      "description": "The timestamp of this list version; i.e. when this immutable version of the list was created"
    },
    "version": {
      "$ref": "#/definitions/Version"
    },
    "tokens": {
      "type": "array",
      "description": "The list of tokens included in the list",
      "items": {
        "$ref": "#/definitions/TokenInfo"
      },
      "minItems": 1
    },
    "keywords": {
      "type": "array",
      "description": "Keywords associated with the contents of the list",
      "items": {
        "type": "string"
      },
      "minItems": 1,
      "uniqueItems": true
    },
    "tags": {
      "type": "object",
      "description": "A mapping of tag identifiers to their name and description",
      "additionalProperties": true
    },
    "logoURI": {
      "type": "string",
      "description": "A URI for the logo of the token list; prefer SVG or PNG of size 256x256",
      "format": "uri-reference"
    }
  },
  "required": ["name", "timestamp", "version", "tokens"]
}
